{
  "audit_track": {
    "active_batch": null,
    "active_manifest": null,
    "active_task": null,
    "blockers": [],
    "completed": [],
    "next_batch": null,
    "phase": "NOT_STARTED"
  },
  "authority": {
    "active_manifest": "business/lots/LOT-45.json",
    "canonical_baseline": "engineering/CANONICAL_BASELINE.json",
    "current_state": "config/governance/project_state.json",
    "historical_evidence_protection": "engineering/HISTORICAL_EVIDENCE_PROTECTION.json",
    "master_plan": "engineering/MASTER_PLAN.md",
    "repository_truth_registry": "engineering/REPOSITORY_TRUTH_REGISTRY.json"
  },
  "business_track": {
    "candidate": {
      "branch": "agent/lot45-order-flow-delta-cvd-engine-v2",
      "lot": 45,
      "merged": false,
      "observed_head": "ec2c4ab16f21b23e062b7fca0bb796c8db4a5133",
      "pr": 66,
      "state": "OPEN",
      "status": "ACTIVE_CANDIDATE"
    },
    "development_status": "ACTIVE",
    "merged_certified_baseline": {
      "implementation_merge": "5c5d3c388abaf10e2e81593a6a3918375a0c0e19",
      "lot": 44,
      "post_merge_audit_head": "0ddf2c3150b339b8573fead8c942c4b1efa4b300",
      "post_merge_audit_merge": "1fd85f26102f94d4c42a8f515b522c23028bac89",
      "post_merge_audit_pr": 64,
      "source_head": "d3cc4cf916ecea5166716746143a593f01b1d051",
      "verdict": "GO_LOT44_POST_MERGE",
      "version": "0.44.0"
    },
    "merged_entry_gate": {
      "merge": "390d0779f2be257fa8134faf8f02193a760a09c3",
      "pr": 65,
      "pr_head": "36a575f2f27da07625875b6fbb579aa75fe4d429",
      "target_lot": 45,
      "verdict": "GO_LOT45_IMPLEMENTATION_ENTRY"
    },
    "next_lot": {
      "lot": 46,
      "status": "LOCKED"
    }
  },
  "cost_policy": {
    "paid_external_api_required": false,
    "paid_llm_required": false,
    "paid_runner_required": false,
    "paid_saas_required": false
  },
  "engineering_track": {
    "active_lot": null,
    "active_manifest": null,
    "active_task": null,
    "blockers": [],
    "branch": "engineering/bootstrap-development-engine",
    "completed": [
      "ENG-00",
      "ENG-01",
      "ENG-02",
      "ENG-03",
      "ENG-04",
      "ENG-05",
      "ENG-06",
      "ENG-07",
      "ENG-08",
      "ENG-09"
    ],
    "next_lot": null,
    "phase": "STABLE"
  },
  "external_observations": {
    "business_candidate": {
      "base": "390d0779f2be257fa8134faf8f02193a760a09c3",
      "head": "ec2c4ab16f21b23e062b7fca0bb796c8db4a5133",
      "merged": false,
      "pr": 66,
      "state": "open"
    },
    "main": {
      "branch_protected": true,
      "sha": "390d0779f2be257fa8134faf8f02193a760a09c3"
    },
    "rulesets_count": 1
  },
  "findings": [
    {
      "code": "MAIN_BRANCH_UNPROTECTED",
      "id": "BOOT-FINDING-001",
      "impact": "Direct pushes or unreviewed changes to main are not prevented by branch protection.",
      "must_be_resolved_before": "BUSINESS_DEVELOPMENT_UNLOCK",
      "observed": false,
      "remediation_target": "ENG-04.6",
      "severity": "HIGH"
    }
  ],
  "freshness_policy": {
    "auto_heal_state_from_external_git": false,
    "mismatch_consequence": "STATE_DRIFT",
    "verify_external_git_on_every_agent_resume": true
  },
  "project": {
    "canonical_name": "Crypto Quant Bot V3.1-Ops",
    "repository": "tobianahillel-afk/Bot-crypto"
  },
  "safety": {
    "execution_allowed": false,
    "leverage": "FORBIDDEN",
    "live_execution": "DISABLED",
    "runtime_max": "OFFLINE_MICROSTRUCTURE_RESEARCH_ONLY",
    "trade_allowed": false,
    "withdrawals": "FORBIDDEN"
  },
  "schema_version": 1,
  "state_kind": "project_state_v1",
  "stop_conditions": [
    "STATE_DRIFT",
    "BUSINESS_SCOPE_TOUCHED_WITHOUT_UNLOCK",
    "FROZEN_EVIDENCE_MUTATION",
    "LOT46_UNLOCK_ATTEMPT",
    "MANDATORY_PAID_DEPENDENCY_INTRODUCED"
  ]
}
